{
  "schemaVersion": "1.0.0",
  "projectId": "proj_02PHASE11PROJ000000000001",
  "rootNodeId": "gnode_02PHASE11NODE00000000001",
  "direction": "downstream",
  "maxDepth": 3,
  "nodes": [
    {
      "schemaVersion": "1.0.0",
      "nodeId": "gnode_02PHASE11NODE00000000001",
      "projectId": "proj_02PHASE11PROJ000000000001",
      "nodeType": "artifact",
      "label": "Requirements",
      "refId": "art_02PHASE11REQ00000000000001",
      "artifactType": "requirement-set",
      "createdAt": "2026-08-04T12:00:00Z"
    },
    {
      "schemaVersion": "1.0.0",
      "nodeId": "gnode_02PHASE11NODE00000000002",
      "projectId": "proj_02PHASE11PROJ000000000001",
      "nodeType": "artifact",
      "label": "Architecture",
      "refId": "art_02PHASE11ARCH000000000001",
      "artifactType": "functional-architecture",
      "createdAt": "2026-08-04T12:00:00Z"
    }
  ],
  "edges": [
    {
      "schemaVersion": "1.0.0",
      "edgeId": "gedge_02PHASE11EDGE00000000001",
      "projectId": "proj_02PHASE11PROJ000000000001",
      "sourceNodeId": "gnode_02PHASE11NODE00000000001",
      "targetNodeId": "gnode_02PHASE11NODE00000000002",
      "edgeType": "depends-on",
      "validFrom": "2026-08-04T12:00:00Z",
      "createdByEventId": "evt_02PHASE11EVT0000000000001"
    }
  ],
  "truncated": false,
  "nodeLimitReached": false,
  "edgeLimitReached": false
}
